{
  "schema_version": "context-request-v1",
  "request_id": "ctx-drop-1042",
  "event_id": "drop-1042",
  "incident_id": "inc-drop-1042",
  "incident_version": 1,
  "context_round": 1,
  "previous_request_id": null,
  "type": "NETWORK_ACCESS_CONTEXT",
  "severity": "medium",
  "created_at": "2026-07-18T17:00:02Z",
  "expires_at": "2026-07-18T17:02:02Z",
  "observed_flow": {
    "source_ip": "10.0.2.1",
    "destination_ip": "10.0.3.10",
    "source_port": 51842,
    "destination_port": 443,
    "protocol": "tcp",
    "timestamp": "2026-07-18T17:00:00Z"
  },
  "permitted_grant_scope": {
    "source_ip": "10.0.2.1",
    "destination_ip": "10.0.3.10",
    "destination_port": 443,
    "protocol": "tcp"
  },
  "matched_policy": {
    "rule_id": "BLOCK_VPN_SOURCE",
    "description": "Connections from known commercial VPN ranges are denied",
    "maximum_ttl_seconds": 600
  },
  "agent_analysis": {
    "summary": "The HTTPS flow was blocked by the VPN-source policy, but network evidence cannot establish whether it is approved work.",
    "missing_context": [
      "Whether the source belongs to an authorized employee",
      "Whether access to this server is currently expected"
    ],
    "trust": "UNTRUSTED_ADVISORY"
  },
  "question": "Is the user associated with 10.0.2.1 authorized to access 10.0.3.10 over HTTPS temporarily?",
  "allowed_responses": [
    "ALLOW_TEMPORARY",
    "KEEP_CURRENT_POLICY",
    "DENY",
    "REQUEST_MORE_INFORMATION"
  ],
  "maximum_ttl_seconds": 600
}
